{
  "format": "llm-foundations-dataset-v1",
  "dataset_id": "22222222-2222-4222-8222-222222222223",
  "name": "capstone-support-v1",
  "record_format": "instruction_intent_v1",
  "origin": "shipped_fixture",
  "eligibility": "eligible",
  "manifest_sha256": "1111111111111111111111111111111111111111111111111111111111111111",
  "splits": {
    "train": {
      "artifact_id": "23232323-2323-4323-8323-232323232323",
      "sha256": "2222222222222222222222222222222222222222222222222222222222222222",
      "records": 30,
      "utf8_bytes": 9925,
      "sealed": false
    },
    "validation": {
      "artifact_id": "24242424-2424-4424-8424-242424242424",
      "sha256": "3333333333333333333333333333333333333333333333333333333333333333",
      "records": 6,
      "utf8_bytes": 1985,
      "sealed": false
    },
    "test": {
      "artifact_id": "25252525-2525-4525-8525-252525252525",
      "sha256": "4444444444444444444444444444444444444444444444444444444444444444",
      "records": 12,
      "utf8_bytes": 3970,
      "sealed": true
    }
  },
  "audit_artifact_id": "26262626-2626-4626-8626-262626262626",
  "created_at": "2026-09-28T12:00:00.000Z"
}
